{
  "$schema": "https://json-schema.org/draft/2020-12/schema",
  "$id": "https://xianxia-engine.com/schemas/system_config.json",
  "title": "System Config Schema",
  "description": "Schema for system configuration",
  "type": "object",
  "required": ["meta", "engine_settings", "game_settings", "feature_flags"],
  "properties": {
    "meta": {"$ref": "#/$defs/metaInfo"},
    "engine_settings": {
      "type": "object",
      "required": ["rng_seed", "tick_rate_ms", "autosave_interval_min", "log_level"],
      "properties": {
        "rng_seed": {"type": "integer"},
        "tick_rate_ms": {"type": "integer", "minimum": 10},
        "autosave_interval_min": {"type": "integer", "minimum": 1},
        "backup_count": {"type": "integer", "minimum": 0},
        "log_level": {"type": "string", "enum": ["DEBUG", "INFO", "WARNING", "ERROR"]},
        "debug_mode": {"type": "boolean"},
        "performance_profiling": {"type": "boolean"}
      }
    },
    "game_settings": {
      "type": "object",
      "properties": {
        "difficulty": {"type": "object"},
        "world_settings": {"type": "object"},
        "balance_settings": {"type": "object"}
      }
    },
    "feature_flags": {
      "type": "object",
      "additionalProperties": {"type": "boolean"}
    },
    "network_settings": {"type": "object"},
    "database_settings": {"type": "object"},
    "cache_settings": {"type": "object"},
    "ai_settings": {"type": "object"},
    "combat_settings": {"type": "object"},
    "economy_settings": {"type": "object"},
    "notification_settings": {"type": "object"},
    "graphics_settings": {"type": "object"},
    "audio_settings": {"type": "object"},
    "localization_settings": {"type": "object"},
    "mod_settings": {"type": "object"},
    "telemetry_settings": {"type": "object"},
    "debug_settings": {"type": "object"},
    "validation_rules": {"type": "object"},
    "rate_limits": {"type": "object"},
    "scheduled_events": {"type": "object"},
    "plugin_hooks": {"type": "object"},
    "performance_thresholds": {"type": "object"},
    "_custom_tags": {"$ref": "#/$defs/customTags"}
  },
  "$defs": {
    "metaInfo": {
      "type": "object",
      "required": ["version", "description", "schema_version"],
      "properties": {
        "version": {"type": "string", "pattern": "^\\d+\\.\\d+\\.\\d+$"},
        "description": {"type": "string"},
        "schema_version": {"type": "string"},
        "last_modified": {"type": "string", "format": "date"}
      }
    },
    "customTags": {
      "type": "array",
      "items": {"type": "string"}
    }
  }
}
